{
  "compilation_timestamp": "2026-07-21T12:00:00Z",
  "compiler": {
    "compiler_name": "AIOM Sentinel Compiler",
    "compiler_sha256": "6838ca566d6545b10ccbdd35a6a4a5d2fd3ea8c74024f654cdadfa104927ba55",
    "compiler_version": "1.0.0"
  },
  "error_log": "",
  "input_hashes": {
    "source.rule": "aaaaaaaaaaaaaaaaaaaaaaaaaaaaaaaaaaaaaaaaaaaaaaaaaaaaaaaaaaaaaaaa"
  },
  "output_bundle_id": "aaaaaaaaaaaaaaaaaaaaaaaaaaaaaaaaaaaaaaaaaaaaaaaaaaaaaaaaaaaaaaaa",
  "status": "PASS"
}